1;24/3/23;Augustusplatz, Opernseite - Paulinum - Kurt-Masur-Platz - Schillerstraße - oberer Martin-Luther-Ring - Zwiku vor dem Neuen Rathaus - Martin-Luther-Ring (Innenring) - Dittrichring (Innenring) - Thomaskirchhof - Thomasgasse - Markt - Katharinenstraße - Brühl - Am Hallischen Tor - Willy-Brandt-Platz (Innenring) - Georgiring (Innenring) - Augustusplatz (Innenring) - Augustusplatz, Opernseite;Augustusplatz, Paulinum, Kurt-Masur-Platz, Schillerstraße, Martin-Luther-Ring, Neues Rathaus, Martin-Luther-Ring, Dittrichring, Thomaskirchhof, Markt, Katharinenstraße, Brühl, Am Hallischen Tor, Willy-Brandt-Platz, Georgiring, Augustusplatz;10:00 Uhr bis 12:00 Uhr;ver.di Bezirk Leipzig Nordsachsen;Aufzug;" ""Tarifrunde ÖD 2023 - Zusammen geht mehr""";1000;;;;;;;
2;24/3/23;Floßplatz Ecke Paul-Gruner-Straße;Floßplatz;09:30 Uhr bis 11:15 Uhr;Sächsischer Erzieherverband im SLV;ortsfest;Warnstreikaktion des SEV im Rahmen der Einkommensrunde mit Bund und Kommunen;200;;;;;;;
3;24/3/23;Platz vor LVZ, Peterssteinweg 19;Peterssteinweg 19;10:00 Uhr bis 12:00 Uhr;natürliche Person;ortsfest;Runde der Verantwortung 2. LVZ;50;;;;;;;
4;24/3/23;öffentlicher Gehweg im Bereich Georgiring 3;Georgiring 3;07:00 Uhr bis 09:00 Uhr;ver.di Bezirk Leipzig-Nordsachsen;ortsfest;" ""Streikposten vor den Betriebshöfen der LVB""";2;;;;;;;
5;24/3/23;Augustusplatz, Opernseite;Augustusplatz;07:00 Uhr bis 15:00 Uhr;ver.di Bezirk Leipzig Nordsachsen;ortsfest;Tarifrunde ÖD 2023 - Zusammen geht mehr;1000;;;;;;;
6;25/3/23;Markt (auf der Höhe Markt 9);Markt 9;12:00 Uhr bis 15:00 Uhr;natürliche Person;ortsfest;"Demo zum Welttag der Abschaffung von Fischerei""";15;;;;;;;
7;25/3/23;Augustusplatz, Gewandhausseite(Sammlung&Auftakt) - Grimmaische Straße - Reichsstraße - Brühl - Katharinenstraße - Markt (Zwischenkundgebung á 10 Minuten) - Petersstraße - Schillerstraße - Neumarkt - Grimmaische Straße - Augustusplatz, Gewandhausseite (Abschluss&Beendigung);Augustusplatz, Grimmaische Straße, Reichsstraße, Brühl, Katharinenstraße, Markt, Petersstraße, Schillerstraße, Neumarkt, Grimmaische Straße, Augustusplatz;15:00 Uhr bis 16:45 Uhr;Bewegung Leipzig;Aufzug;" ""Für Frieden und eine freie Impfentscheidung für Alle""";150;;;;;;;
8;25/3/23;Markt;Markt;14:30 Uhr bis 18:00 Uhr;natürliche Person;ortsfest;Galerie der Aufklärung;200;;;;;;;
9;25/3/23;Markt;Markt;13:00 Uhr bis 15:00 uhr;Initiative Friedenswende 23;ortsfest;Frieden schaffen ohne Waffen;10;;;;;;;
10;27/3/23;Sandberg, Ecke Weinberg;Sandberg;16:00 Uhr bis 17:00 Uhr;AfD KV Leipzig;ortsfest;Sachsen braucht eine bessere Politik!;10;;;;;;;
11;27/3/23;öffentlicher Fußweg im Bereich der Theresienstraße, Ecke B2;Theresienstraße;16:00 Uhr bis 17:00 Uhr;AfD KV Leipzig;ortsfest;Sachsen braucht eine bessere Politik!;10;;;;;;;
12;27/3/23;Gehweg südöstlich der Kreuzung Wilhelm-Seyfferth-Straße/Wächterstraße;Wilhelm-Seyfferth-Straße;17:15 Uhr bis 18:00 Uhr;AfD;ortsfest;USA = Terrorstaat, Ami go home;10;;;;;;;
13;27/3/23;kleiner Willy-Brandt-Platz;Willy-Brandt-Platz;18:00 Uhr bis 19:30 Uhr;Montagsdemobewegung Leipzig;ortsfest;Tag des Widerstands - für eine lebenswerte Zukunft international! Aktiv gegen die Weltkriegsgefahr - wir zahlen nicht für eure Kriege!;10;;;;;;;
14;27/3/23;Augustusplatz, Gewandhausseite - Innenstadtring (Innenring) im Uhrzeigersinn - Goethestraße - Augustusplatz, Gewandhausseite (Abschluss&Beendigung);Augustusplatz, Roßplatz, Dittrichring, Tröndlinring, Goethestraße, Augustusplatz;19:00 Uhr bis 21:00 Uhr;Montagsdemo Leipzig;Aufzug;Frieden und Freiheit für Alle;400;;;;;;;
15;27/3/23;Kleiner Willy-Brandt-Platz;Willy-Brandt-Platz;05:00 Uhr bis 10:30 Uhr;Eisenbahn- und Verkehrsgewerkschaft (EVG);ortsfest;" EVG und ver.di - Warnstreik ""Gemeinsam geht mehr - Zusammen geht mehr!""";400;;;;;;;
16;27/3/23;Auftaktkundgebung: vor dem Neuen Rathaus (Seite Martin-Luther-Ring), Aufzugsstrecke: Leuschner Platz, Petersteinweg, Karl-Liebknecht-Straße bis Kurt-Eisner-Straße (wenden!), Karl-Liebknecht-Straße, Petersteinweg, Leuschner Platz, Martin-Luther-Ring, Dittrichring, Goerdelerring, Tröndlinring, Via Regia;Neues Rathaus, Leuschner Platz, Peterssteinweg, Karl-Liebknecht-Straße, Kurt-Eisner-Straße, Karl-Liebknecht-Straße, Peterssteinweg, Leuschner Platz, Martin-Luther-Ring, Dittrichring, Goerdelerring, Tröndlinring;16:00 Uhr bis 18:00 Uhr;Die Linke.SDS Leipzig;Fahrradaufzug;Verkehrswende - jetzt erst recht ;300;;;;;;;
17;27/3/23;kleiner Willy-Brandt-Platz -> Georgiring -> Augustusplatz -> Roßplatz -> Martin-Luther-Ring -> Vorplatz Rathaus -> Martin-Luther-Ring -> Dittrichring -> Goerdelerring -> Tröndlinring -> kleiner Willy-Brandt-Platz;Willy-Brandt-Platz, Georgiring, Augustusplatz,  Roßplatz, Martin-Luther-Ring, Neues Rathaus, Martin-Luther-Ring, Dittrichring, Goerdelerring, Tröndlinring, Willy-Brandt-Platz;10:30 Uhr bis 13:00 Uhr;ver.di Bezirk Leipzig Nordsachsen;Aufzug;Zusammen geht mehr;400;;;;;;;
18;27/3/23;Augustusplatz, östliche Opernseite (Sammlung & Auftakt) - Augustusplatz (Mittelfahrbahn) - Augustusplatz (Paulinum) - Kurt-Masur-Platz - Schillerstraße - oberer Martin-Luther-Ring - Hugo-Licht-Straße - Burgplatz (Zwischenkundgebung) - Lotterstraße - oberer Martin-Luther-Ring - oberer Dittrichring - Richard-Wagner-Straße (Geh-/Radweg beginnend an der Runden Ecke) - Goethestraße - Augustusplatz (Mittelfahrbahn) - Augustusplatz, östliche Opernseite (Abschluss & Beendigung);Augustusplatz, Kurt-Masur-Platz, Schillerstraße, Martin-Luther-Ring, Hugo-Licht-Straße, Burgplatz, Lotterstraße, Martin-Luther-Ring, Dittrichring, Richard-Wagner-Straße, Goethestraße, Augustusplatz;19:00 Uhr bis 21:00 Uhr;natürliche Person;Aufzug;Raus aus NATO und EU;50;;;;;;;
19;27/3/23;Augustusplatz, Opernseite;Augustusplatz;18:00 Uhr bis 22:00 Uhr;"Aktionsnetzwerk ""Leipzig nimmt Platz"" und Leipzig schwurbelfrei";ortsfest;Faschist:innen den Tag versauen;100;;;;;;;
1;9/6/23;Sachsenbrücke;Sachsenbrücke;15:00 Uhr bis 18:00 Uhr;Scientists4Future;stationär;Klimafakten zum Feierabend;5;
2;9/6/23;Richard-Wagner-Platz;Richard-Wagner-Platz;08:30 Uhr bis 14:00 Uhr;ver.di - Bezirk Leipzig/Nordsachsen Fachbereich Handel;stationär; Arbeitskampf im Einzelhandel u. Versandhandel Sachsen, Sachsen-Anhalt und Thüringen;200;
3;9/6/23;öffentlicher Gehweg im Bereich der Altenburger Straße, vor dem Haupteingang MDR (vor den Fahnenstangen);Altenburger Straße 13;09:00 Uhr bis 10:00 Uhr;natürliche Person;stationär;Leuchtturm ARD;4;
4;10/6/23;vor Petersstraße 14 (Filiale McDonalds);Petersstraße 14;14:00 Uhr bis 17:00 Uhr;natürliche Person;stationär;Tierrechte und vegane Lebensweise;8;
5;10/6/23;Markt;Markt;12:00 Uhr bis 18:00 Uhr;natürliche Person;stationär;Menschenrechte im Iran;7;
6;10/6/23;Neues Rathaus (Sammlung & Auftakt) - Martin-Luther-Ring (Innenring) - Dittrichring (Innenring) - Goerdelerring (Innenring) - Tröndlinring (Innenring) - Willy-Brandt-Platz (Innenring) - Kleiner Willy-Brandt-Platz (Zwischenkundgebung) - Nikolaistraße - Grimmaische Straße - Augustusplatz, Opernseite (Abschluss & Beendigung);Neues Rathaus, Martin-Luther-Ring, Dittrichring, Goerdelerring, Tröndlinring, Willy-Brandt-Platz, Nikolaistraße, Grimmaische Straße, Augustusplatz;14:00 Uhr bis 18:00 Uhr;Kiwest e. V.;;Platz da für Kinder;300;
7;10/6/23;Johannapark, hinter dem Clara-Zetkin-Denkmal;Karl-Tauchnitz-Straße 15;17:00 Uhr bis 21:00 Uhr;Rebellgruppe (Jugendverband) Leipzig;stationär;Internationale Solidarität statt rechter Hetze;50;
8;10/6/23;Augustusplatz, Gewandhausseite (Sammlung & Auftakt) - Grimmaische Straße - Reichsstraße - Brühl (Zwischenkundgebung im Bereich zw. Katharinen- und Hainstraße) - Große Fleischergasse - oberer Dittrichring - Thomaskirchhof - Thomasgasse - Petersstraße - Schillerstraße - Neumarkt - Grimmaische Straße - Augustusplatz, Gewandhausseite (Abschluss & Beendigung);Augustusplatz, Grimmaische Straße, Reichsstraße, Brühl, Große Fleischergasse, Dittrichring, Thomaskirchhof, Thomasgasse, Petersstraße, Schillerstraße, Neumarkt, Grimmaische Straße, Augustusplatz;15:00  Uhr bis 16:45 Uhr;Bewegung Leipzig;Aufzug;Für Frieden und vollständige Aufklärung der Corona Krise.;150;
9;11/6/23;"Augustusplatz; Opernseite (Sammlung & Auftakt, 13-14 Uhr) - Grimmaische Straße - südlicher Markt - Petersstraße - kleiner Wilhelm-Leuschner-Platz (Zwischenkundgebung,14:45 - 15:30) - westlicher Wilhelm-Leuschner-Platz (Straße) - Peterssteinweg - Riemannstraße - Floßplatz - Harkortstraße - Beethovenstraße - Simsonplatz (Zwischenkundgebung, 16:15 - 17:00) - Beethovenstraße - Herzliyaplatz - Anton-Bruckner-Allee - Liegewiese zwischen Anton-Bruckner-Allee und Johannaparkweg (Abschluss & Beendigung, 17:30 - 19:00)";Augustusplatz, Grimmaische Straße, Markt, Petersstraße, Wilhelm-Leuschner-Platz, Peterssteinweg, Riemannstraße, Floßplatz, Harkortstraße, Beethovenstraße, Simsonplatz, Beethovenstraße, Herzliyaplatz, Anton-Bruckner-Allee, Johannaparkweg;13:00 Uhr bis 20:00 Uhr;Queering defaults;Aufzug;The Future is Intersectional: Qeer Movements;500;
10;12/6/23;öffentlicher Fußweg im Bereich Theresienstraße, Ecke B2;Theresienstraße 79;16:00 Uhr bis 17:00 Uhr;AfD-KV Leipzig, Ortsgruppe Nord;stationär;Sachsen braucht eine bessere Politik! Dem Frieden eine Chance;10;
11;12/6/23;öffentlicher Gehweg südöstlich der Kreuzung Wilhelm-Seyfferth-Straße/Wächterstraße;Wächterstraße 32;17:15 Uhr bis 18:00 Uhr;Alternative für Deutschland Kreisverband Leipzig;stationär;Dem Frieden eine Chance!;10;
12;12/6/23;Augustusplatz, Gewandhausseite (Sammlung & Auftakt) - Augustusplatz (Mittelfahrbahn) - Augustusplatz (Innenring) - Roßplatz (Innenring) - Wilhelm-Leuschner-Platz (Innenring) - Martin-Luther-Ring (Innenring) - Dittrichring (Innnenring) - Goerdelerring (Innenring) - Tröndlinring (Innenring) - Willy-Brandt-Platz (Innenring) - Goethestraße - Augustusplatz (Mittelfahrbahn) - Augustusplatz, Gewandhausseite (Abschluss & Beendigung);Augustusplatz, Roßplatz, Wilhelm-Leuschner-Platz, Martin-Luther-Ring, Dittrichring, Goerdelerring, Tröndlinring, Willy-Brandt-Platz, Goethestraße, Augustusplatz;19:00 Uhr bis 21:00 Uhr;Montagsdemo Leipzig;Aufzug;Frieden und Freiheit für Alle;400;
13;12/6/23;Augustusplatz, Opernseite (Sammlung & Auftakt) - Augustusplatz, Paulinum - Kurt-Masur-Platz - Universitätsstraße - Grünewaldstraße - Windmühlenstraße - südl. Wilhelm-Leuschner-Platz - Dimitroffstraße - Simsonplatz - Wächterstraße - Wilhelm-Seyfferth-Straße - Karl-Tauchnitz-Straße - Friedrich-Ebert-Straße - Reichelstraße - Otto-Schill-Straße - oberer Dittrichring - Thomaskirchhof - Thomasgasse - Markt - Grimmaische Straße - Augustusplatz, Opernseite (Abschluss & Beendigung);Augustusplatz, Kurt-Masur-Platz, Universitätsstraße, Grünewaldstraße, Windmühlenstraße, Wilhelm-Leuschner-Platz, Dimitroffstraße, Simsonplatz, Wächterstraße, Wilhelm-Seyfferth-Straße, Karl-Tauchnitz-Straße, Friedrich-Ebert-Straße, Reichelstraße, Otto-Schill-Straße, Dittrichring, Thomaskirchhof, Thomasgasse, Markt, Grimmaische Straße, Augustusplatz;19:00 Uhr bis 21:00 Uhr;natürliche Person;Aufzug;Raus aus NATO und EU;50;
14;12/6/23;Fuggerstraße,  Gehwegbereich südlich des Kreisverkehrs;Fuggerstraße 1;13:30 Uhr bis 14:30 Uhr;IG Metall Leipzig;stationär;Kundgebung zur Tarifrunde Textile Dienste;60;
15;12/6/23;Markt;Markt;11:30 Uhr bis 13:30 Uhr;Leipzig gegen Krieg - Leipziger Anti-Kriegsforum;stationär;Frieden schaffen ohne Waffen! Stoppt Air Defender 2023;40;
16;12/6/23;Richterplatz an Kreuzung Richterstraße / Trufanowstraße;Richterstraße 9;12:00 Uhr bis 15:30 Uhr;ver.di Bezirk Leipzig-Nordsachsen;stationär;JAV-Wahlen Uniklinik;15;
